<?xml version="1.0" encoding="UTF-8"?>
<!-- XML root, xsi:schemaLocation allows to tie a document to its XML Schema by using
     schemaLocation or noNamespaceSchemaLocation. transcript is default ns -->
<tscp:Transcript
        xmlns:tscp="http://www.limmen.kth.se.id2208.hw1.transcript"
        xmlns:xsi="http://www.w3.org/2001/XMLSchema-instance"
        xsi:schemaLocation="http://www.limmen.kth.se.id2208.hw1.transcript ./../schemas/transcript.xsd"
        universityName="KTH"
        generationDate="2017-01-23">

    <tscp:Student>
        <tscp:FirstName>John</tscp:FirstName>
        <tscp:LastName>Doe</tscp:LastName>
        <tscp:CivicRegistrationNumber>910406-1337</tscp:CivicRegistrationNumber>
    </tscp:Student>

    <tscp:Degrees>
        <tscp:Degree>
            <tscp:Name>Master of Distributed Systems</tscp:Name>
            <tscp:DateOfIssue>2014-09-16</tscp:DateOfIssue>
            <tscp:DateOfCompletion>2014-06-04</tscp:DateOfCompletion>
            <tscp:Credits>180</tscp:Credits>
        </tscp:Degree>
    </tscp:Degrees>

    <tscp:Courses>
        <tscp:Course>
            <tscp:Name>Grid Computing</tscp:Name>
            <tscp:Code>IJ2208</tscp:Code>
            <tscp:Credits>7.5</tscp:Credits>
            <tscp:Date>2016-03-16</tscp:Date>
            <tscp:Grade>A</tscp:Grade>
        </tscp:Course>
        <tscp:Course>
            <tscp:Name>Distributed Systems Architecture</tscp:Name>
            <tscp:Code>IJ2213</tscp:Code>
            <tscp:Credits>7.5</tscp:Credits>
            <tscp:Date>2016-03-16</tscp:Date>
            <tscp:Grade>A</tscp:Grade>
        </tscp:Course>
    </tscp:Courses>

</tscp:Transcript>
